{"$id":"https://surfaces.dev/schemas/designer-workflow-trace/designer-workflow-trace-fixture.v0.schema.json","$schema":"https://json-schema.org/draft/2020-12/schema","additionalProperties":false,"properties":{"claims":{"additionalProperties":false,"properties":{"a2ui":{"type":"boolean"},"actionExecution":{"type":"boolean"},"api":{"type":"boolean"},"callbackExecution":{"type":"boolean"},"customerValidation":{"type":"boolean"},"liveAgentExecution":{"type":"boolean"},"liveJudgmentKit":{"type":"boolean"},"liveSurfaceOps":{"type":"boolean"},"networkCallExecution":{"type":"boolean"},"p6":{"type":"boolean"},"p7":{"type":"boolean"},"productWorkflowImplementation":{"type":"boolean"},"productionAdapter":{"type":"boolean"},"productionAdoption":{"type":"boolean"},"runtime":{"type":"boolean"},"sdk":{"type":"boolean"},"secretAccess":{"type":"boolean"},"toolCallExecution":{"type":"boolean"},"workOrderExecution":{"type":"boolean"}},"required":["productWorkflowImplementation","customerValidation","productionAdoption","liveSurfaceOps","liveJudgmentKit","liveAgentExecution","toolCallExecution","networkCallExecution","callbackExecution","secretAccess","actionExecution","workOrderExecution","productionAdapter","api","sdk","runtime","a2ui","p6","p7"],"type":"object"},"componentId":{"type":"string"},"fixtureId":{"type":"string"},"provenance":{"additionalProperties":false,"properties":{"generatedAt":{"const":"1970-01-01T00:00:00.000Z"},"generator":{"type":"string"},"sourceRefs":{"items":{"type":"string"},"type":"array"}},"required":["generatedAt","generator","sourceRefs"],"type":"object"},"requiredArtifactPaths":{"const":["artifacts/p2/governed-catalog.json","artifacts/p2/ingestion-report.json","artifacts/source-conformance/source-authority-map.json","artifacts/source-conformance/source-conformance-report.json","artifacts/source-conformance/source-review-queue.json","artifacts/p3/review-queue.json","artifacts/p4/surfaceops-decision-ledger.json","artifacts/p4/review-judgment-report.json","artifacts/p4/judgmentkit-evaluation-report.json","artifacts/p5/protocol/adapter-target-selection.json","artifacts/p5/protocol/protocol-projection.json","artifacts/p5/protocol/protocol-envelope.button.json","artifacts/p5/protocol/protocol-adapter-report.json","artifacts/p5/native/adapter-target-selection.json","artifacts/p5/native/surfaces-native-projection.json","artifacts/p5/native/surfaces-native-packet.button.json","artifacts/p5/native/surfaces-native-report.json"]},"requiredEvidencePaths":{"const":["artifacts/p2/evidence.json","artifacts/source-conformance/evidence.json","artifacts/p3/evidence.json","artifacts/p4/evidence.json","artifacts/p5/protocol/evidence.json","artifacts/p5/native/evidence.json"]},"requiresReviewStatus":{"type":"boolean"},"scenarioId":{"const":"p2-button-authority-to-static-handoff"},"schemaId":{"const":"designer-workflow-trace-fixture.v0"},"targetIds":{"items":{"enum":["surfaces-protocol-static","surfaces-native-static"]},"maxItems":2,"minItems":1,"type":"array","uniqueItems":true},"version":{"type":"string"}},"required":["schemaId","version","fixtureId","scenarioId","componentId","targetIds","requiredEvidencePaths","requiredArtifactPaths","requiresReviewStatus","claims","provenance"],"type":"object"}