{"claims":{"a2ui":false,"actionExecution":false,"api":false,"callbackExecution":false,"customerValidation":false,"liveAgentExecution":false,"liveJudgmentKit":false,"liveSurfaceOps":false,"networkCallExecution":false,"p6":false,"p7":false,"productWorkflowImplementation":false,"productionAdapter":false,"productionAdoption":false,"runtime":false,"sdk":false,"secretAccess":false,"toolCallExecution":false,"workOrderExecution":false},"componentId":"Button","fixtureId":"button-authority-to-handoff","provenance":{"generatedAt":"1970-01-01T00:00:00.000Z","generator":"interfacectl-designer-workflow-trace-materialize","sourceRefs":["fixture://designer-workflow-trace/button-authority-to-handoff"]},"requiredArtifactPaths":["artifacts/p2/governed-catalog.json","artifacts/p2/ingestion-report.json","artifacts/source-conformance/source-authority-map.json","artifacts/source-conformance/source-conformance-report.json","artifacts/source-conformance/source-review-queue.json","artifacts/p3/review-queue.json","artifacts/p4/surfaceops-decision-ledger.json","artifacts/p4/review-judgment-report.json","artifacts/p4/judgmentkit-evaluation-report.json","artifacts/p5/protocol/adapter-target-selection.json","artifacts/p5/protocol/protocol-projection.json","artifacts/p5/protocol/protocol-envelope.button.json","artifacts/p5/protocol/protocol-adapter-report.json","artifacts/p5/native/adapter-target-selection.json","artifacts/p5/native/surfaces-native-projection.json","artifacts/p5/native/surfaces-native-packet.button.json","artifacts/p5/native/surfaces-native-report.json"],"requiredEvidencePaths":["artifacts/p2/evidence.json","artifacts/source-conformance/evidence.json","artifacts/p3/evidence.json","artifacts/p4/evidence.json","artifacts/p5/protocol/evidence.json","artifacts/p5/native/evidence.json"],"requiresReviewStatus":false,"scenarioId":"p2-button-authority-to-static-handoff","schemaId":"designer-workflow-trace-fixture.v0","targetIds":["surfaces-protocol-static","surfaces-native-static"],"version":"0.0.0"}